Name of Place,Location,Type,Official Website,Wikipedia,Nearest Railway Station,Nearest Bus Stand,Nearest Metro Station,Nearest Airport,Timings,Entry Fee,Best Time to Visit,Accessibility,Guided Tours,Parking,Nearby Amenities,Special Notes
Tawang Monastery,"Tawang town, Tawang district, Arunachal Pradesh",Buddhist Monastery / Cultural Heritage Site,Not documented,https://en.wikipedia.org/wiki/Tawang_Monastery,Bhalukpong / Rangapara North / Tezpur (Assam) — approx. 270–330 km,Tawang Bus Stand,No metro available,Tezpur (Salonibari) ~330 km / Guwahati ~480 km,Generally daylight visiting hours,Free (donations welcome),April–October,Mountain roads; not wheelchair-friendly,Local guides available,Limited roadside parking,"Hotels, guesthouses, restaurants, souvenir shops in Tawang town",One of the largest Tibetan Buddhist monasteries in India; major seat of Mahayana Buddhism
Sela Pass & Sela Lake (Sela Tso),"On the Tezpur–Tawang highway (NH 13), between Tawang and Bomdila, Arunachal Pradesh",High-altitude Mountain Pass / Scenic Lake,Not documented,https://en.wikipedia.org/wiki/Sela_Pass,Tezpur / Rangapara North — 300–360 km,Tawang / Bomdila bus stands,No metro available,Tezpur ~330 km / Guwahati ~480 km,Accessible in daytime; often blocked in winter,Not documented (ILP required for Arunachal entry),April–October,"High-altitude pass (13,700 ft); steep, winding roads",Local drivers/guides from Tawang and Bomdila,Small roadside parking near viewpoints,Minimal facilities; better hotels and restaurants in Tawang & Bomdila,Sacred to Buddhists; famous turquoise Sela Lake; strategic military post nearby
Nuranang Falls (Jang Falls / Bong Bong Falls),"Near Jang town, ~40 km from Tawang, Tawang District, Arunachal Pradesh",Waterfall / Natural Attraction,Not documented,https://en.wikipedia.org/wiki/Nuranang_Falls,Rangapara North / Tezpur / Naharlagun — 240–360 km,Jang town (2 km from falls),No metro available,Tezpur ~330 km / Guwahati ~480 km,Daytime access (sunrise–sunset),Free,May–October,Motoring road up to viewing area; short walk to base,Local guides sometimes available,Roadside parking available,Small shops and tea stalls in Jang; hotels & restaurants in Tawang,"Filming location of Bollywood song “Tanhai Tanhai” (Koyla); pristine, less crowded waterfall"
Bomdila Monastery,"Bomdila town, West Kameng District, Arunachal Pradesh",Buddhist Monastery / Cultural Heritage,Not documented,https://en.wikipedia.org/wiki/Bomdila_Monastery,Tezpur / Rangapara North — ~150 km,Bomdila Bus Stand (within town),No metro available,Tezpur (Salonibari) ~150 km / Guwahati ~330 km,9:00 am – 6:00 pm,Free,March–October,Hill town; road access from Tezpur/Guwahati,Local guides available in Bomdila,Available near monastery,"Hotels, homestays, cafes, and shops in Bomdila town",Known as “Gentse Gaden Rabgyel Lling” monastery; center for Lamaistic studies
Dirang Valley,"Dirang town, West Kameng District, Arunachal Pradesh",Valley / Scenic Town / Cultural Stopover,Not documented,https://en.wikipedia.org/wiki/Dirang,Tezpur / Rangapara North — ~190 km,Dirang Bus Stop (within town),No metro available,Tezpur ~190 km / Guwahati ~350 km,Open all day,Not applicable,March–May & September–November,Good mountain road; motorable throughout,Local homestays often arrange guides,Available in town,"Resorts, homestays, local eateries, hot springs, shops","Famous for hot water springs, apple orchards, kiwi farms"
Ziro Valley,"Ziro town, Lower Subansiri District, Arunachal Pradesh",Valley / Cultural & Eco-Tourism Destination,Not documented,https://en.wikipedia.org/wiki/Ziro_Valley,Naharlagun (Itanagar) — ~100 km,Ziro Bus Stand,No metro available,Lilabari Airport (Assam) ~130 km / Donyi Polo Airport ~120 km,Open all day,Not applicable,September & March–November,Roads motorable but winding,"Available — local Apatani guides, cultural village walks",Available in town,"Resorts, homestays, restaurants, cafes, music festival grounds, shops","UNESCO Tentative World Heritage Site; famous for Apatani tribal culture, paddy–fish farming"
Namdapha National Park,"Miao town region, Changlang District, Arunachal Pradesh",National Park / Wildlife Sanctuary / Tiger Reserve,https://www.namdaphanationalpark.com/,https://en.wikipedia.org/wiki/Namdapha_National_Park,Tinsukia (Assam) ~140 km,Miao Bus Stand ~26 km,No metro available,Dibrugarh Airport (Assam) ~180 km,8:00 am – 5:00 pm,Indian Nationals ₹50; Foreign Nationals ₹350,October–April,Forest entry by road; treks inside range from easy to difficult,Mandatory entry with permits; forest guides & guards available,Available near Miao gate,"Forest rest houses, basic lodges, small eateries at Miao town",Fourth-largest national park in India; only park with four big cats
Itanagar Gompa (Buddhist Temple),"Hilltop in Itanagar city, Papum Pare District, Arunachal Pradesh",Buddhist Temple / Cultural Landmark,Not documented,https://en.wikipedia.org/wiki/Itanagar,Naharlagun ~15 km,Itanagar Bus Station (within city),No metro available,Donyi Polo Airport (Hollongi) ~25 km,7:00 am – 6:00 pm,Free,Year-round; pleasant from October–April,Within city; short climb uphill (stairs),Local city guides available,Available near temple gate,"Hotels, cafes, restaurants in Itanagar",Yellow-roofed Buddhist Gompa; panoramic city views
Pasighat,"On the banks of the Siang River, East Siang District, Arunachal Pradesh",Town / River Valley / Eco-Tourism Destination,Not documented,https://en.wikipedia.org/wiki/Pasighat,Murkongselek (Assam) ~35 km,Pasighat Bus Stand (within town),No metro available,Pasighat Airport (domestic) ~5 km; Dibrugarh (major airport) ~150 km,Open all day,Not applicable,October–April,Well connected by road from Dibrugarh and Itanagar,"Local guides for rafting, angling, village tours available",Available in town,"Hotels, eco-resorts, markets, restaurants, river camps",Known as the “Gateway to Arunachal”; rafting hotspot
Mechuka Valley (Menchukha),"Remote high-altitude valley, Shi-Yomi District, Arunachal Pradesh",Valley / Eco-Tourism / Adventure Destination,Not documented,https://en.wikipedia.org/wiki/Mechuka,Silapathar (Assam) ~400 km,Aalo (Along) Bus Stand ~180 km,No metro available,Dibrugarh (Assam) ~450 km,Open all day,Not applicable (ILP required for Arunachal entry),October–March,Remote mountain roads; difficult but scenic drive,Local homestays & tourism dept. provide guides,Available near villages & homestays,"Homestays, guesthouses, small eateries; limited shops","Known for ancient Samten Yongcha Monastery, wooden hanging bridges"
Roing,"At the foothills of the Mishmi Hills, Lower Dibang Valley, Arunachal Pradesh",Hill Town / Cultural & Natural Destination,Not documented,https://en.wikipedia.org/wiki/Roing,Tinsukia (Assam) ~150 km,Roing Bus Stand (within town),No metro available,Dibrugarh (Assam) ~160 km,Open all day,Not applicable,October–April,Good road via Assam,Local guides available for Mayodia Pass treks & tribal villages,Available in town,"Hotels, lodges, homestays, small restaurants","Gateway to Mayodia Pass, Mehao Wildlife Sanctuary"
Daporijo,"On the banks of the Subansiri River, Arunachal Pradesh",River Valley Town / Tribal Culture Destination,Not documented,https://en.wikipedia.org/wiki/Daporijo,Silapathar (Assam) ~120 km,Daporijo Bus Stand (within town),No metro available,Lilabari (Assam) ~150 km,Open all day,Not applicable,October–April,Mountain roads; long winding routes,"Available — local guides for trekking, tribal village tours",Available in town,"Basic hotels, shops, local eateries","Known for bamboo suspension bridges, tribal culture of Tagin & Hill Miri tribes"
Sangti Valley,"15 km from Dirang town, West Kameng District, Arunachal Pradesh",Valley / Eco-Tourism / Birdwatching Destination,Not documented,https://en.wikipedia.org/wiki/Sangti_Valley,Tezpur ~190 km,Dirang Bus Stop ~15 km,No metro available,Tezpur ~190 km / Guwahati ~350 km,Open all day,Not applicable,November–March,Road from Dirang; motorable,Local birdwatching and trekking guides available,Available near villages,"Homestays, eco-resorts, local restaurants","Famous for black-necked cranes (migratory birds), apple & kiwi orchards"
Parshuram Kund,"On the Brahmaputra (Lohit River) banks, Lohit District, Arunachal Pradesh",Pilgrimage Site / Riverbank Religious Destination,Not documented,https://en.wikipedia.org/wiki/Parshuram_Kund,Tinsukia (Assam) ~120 km,Tezu Bus Stand ~21 km,No metro available,Dibrugarh (Assam) ~180 km / Tezu Airport ~20 km,Open all year; peak during Makar Sankranti (Jan),Free (donations welcome),January; otherwise October–March,Road motorable up to kund; steps down to river,Pilgrimage organizers & local guides available,Available near kund,"Guesthouses in Tezu, small stalls near kund",Sacred Hindu pilgrimage; lakhs of devotees take a holy dip every January
Pangsau Pass & Lake of No Return,"Indo–Myanmar border, near Nampong town, Changlang District, Arunachal Pradesh",Border Pass / Historical & Scenic Destination,Not documented,https://en.wikipedia.org/wiki/Pangsau_Pass,Tinsukia (Assam) ~140 km,Nampong Bus Stand ~12 km,No metro available,Dibrugarh (Assam) ~180 km,Daylight hours,Free (ILP required; special permits for border fair),January (Pangsau Pass Winter Festival),Hill roads from Nampong; motorable but steep and winding,Available via tourism dept. during festival; local guides for WWII trail tours,Limited roadside parking,Homestays & small eateries at Nampong,Famous for WWII history (Stilwell Road); Lake of No Return associated with legends
Mayodia Pass,"~56 km from Roing town, Lower Dibang Valley District, Arunachal Pradesh",Mountain Pass / Scenic Drive / Snow Destination,Not documented,https://en.wikipedia.org/wiki/Mayodia_Pass,Tinsukia (Assam) ~150 km,Roing Bus Stand ~56 km,No metro available,Dibrugarh (Assam) ~160 km,Open all day (seasonal closures in heavy snow),Free,December–March & October–April,"Motorabale by road (NH13), winding roads with hairpin bends",Local guides from Roing available for snow treks,Roadside parking available,Rest houses in Roing; tea stalls on route,Famous for snow in winter; scenic views of Dibang Valley
Aalo (Along),"At the confluence of Siyom and Sipu rivers, West Siang District, Arunachal Pradesh",Town / Cultural & Natural Destination,Not documented,https://en.wikipedia.org/wiki/Aalo,Silapathar (Assam) ~150 km,Aalo Bus Stand (within town),No metro available,Dibrugarh (Assam) ~300 km,Open all day,Not applicable,October–April,Connected by road from Pasighat & Likabali,Available — local guides for tribal village tours,Available in town,"Hotels, homestays, markets, eateries",Known for hanging bridges made of bamboo and cane
Dambuk (Orange Festival of Adventure & Music),"Dambuk town, Lower Dibang Valley District, Arunachal Pradesh",Festival Destination / Music & Adventure Tourism,https://www.orangefestival.in/,Not documented,Tinsukia (Assam) ~120 km,Roing Bus Stand ~30 km,No metro available,Dibrugarh (Assam) ~150 km,Annual (December) — 4-day festival,₹1000–₹2000 (varies by day/pass),December (during festival dates),Motorabale roads; last stretch slightly rough,Festival packages & local guides available,Designated festival parking,"Festival camps, homestays, food stalls, adventure activity zones",Combines adventure sports with indie/rock music; promotes local oranges & tribal culture
Golden Pagoda (Kongmu Kham),"Chongkham town, Namsai District, Arunachal Pradesh",Buddhist Temple / Cultural Landmark,Not documented,"https://en.wikipedia.org/wiki/Golden_Pagoda,_Namsai",Tinsukia (Assam) ~60 km,Namsai Bus Stand ~10 km,No metro available,Dibrugarh (Assam) ~80 km,8:00 am – 6:00 pm,Free,October–March,Easily accessible by road; temple complex wheelchair-friendly in many parts,Available via local tourism offices,Large parking area,"Hotels in Namsai, restaurants, meditation centers",A Burmese-style temple built in 2010; important Theravada Buddhist pilgrimage
Talley Valley Wildlife Sanctuary,"~30 km from Ziro town, Lower Subansiri District, Arunachal Pradesh",Wildlife Sanctuary / Trekking Destination,Not documented,https://en.wikipedia.org/wiki/Talley_Valley_Wildlife_Sanctuary,Naharlagun (Itanagar) ~120 km,Ziro Bus Stand ~30 km,No metro available,Lilabari (Assam) ~140 km,Daytime entry with permits,Not documented (forest permit required),October–April,Trekking trails only,Compulsory with forest guides; trekking packages available,Parking available near trail start,Homestays in Ziro; basic forest huts on trek,Dense subtropical forests; endangered clouded leopards; UNESCO tentative heritage zone
Bhismaknagar Fort,"Near Roing town, Lower Dibang Valley District, Arunachal Pradesh",Archaeological / Historical Monument,Not documented,https://en.wikipedia.org/wiki/Bhismaknagar,Tinsukia (Assam) ~150 km,Roing Bus Stand ~30 km,No metro available,Dibrugarh (Assam) ~160 km,9:00 am – 5:00 pm,Not documented,October–April,Motoring road up to fort site; moderate walking required,Local guides available at site,Available,"Lodges in Roing town, small shops near site",8th-century fort of Chutia dynasty; one of the oldest archaeological sites in Arunachal
Malinithan Temple,"Likabali town, Lower Siang District, Arunachal Pradesh",Archaeological Temple Ruins / Pilgrimage Site,Not documented,https://en.wikipedia.org/wiki/Malinithan_Temple,Silapathar (Assam) ~15 km,Likabali Bus Stand ~2 km,No metro available,Dibrugarh (Assam) ~100 km,6:00 am – 7:00 pm,Free,October–March,Easily motorable; steps at temple site,Local temple guides available,Available,Hotels in Likabali; local eateries & shops,Archaeological site (8th–12th century); associated with Krishna–Rukmini legends
Tipi Orchidarium,"Tipi town, ~5 km from Bhalukpong, West Kameng District, Arunachal Pradesh",Orchid Research Centre / Botanical Attraction,Not documented,https://en.wikipedia.org/wiki/Tipi_Orchidarium,Bhalukpong (Assam/Arunachal border) ~5 km,Bhalukpong Bus Stand ~5 km,No metro available,Tezpur (Salonibari) ~60 km,8:00 am – 4:00 pm (closed on Sundays),₹20 (approx.),March–April,Motoring road; wheelchair access limited inside greenhouses,Available; staff provide orchid information,Available,Small shops nearby; hotels & eateries in Bhalukpong,Houses over 1000 species of orchids; major research & conservation center
