Name,District,Type,Official Website,Wikipedia,Nearest Railway Station,Nearest Bus Stand,Nearest Metro Station,Nearest Airport,Timings,Entry Fee,Best Time to Visit,Accessibility,Guided Tours,Parking,Nearby Amenities,Special Notes
Statue of Unity,Kevadia,Historical Monument / Tourist Attraction,https://www.statueofunity.com/,https://en.wikipedia.org/wiki/Statue_of_Unity,Kevadia Station (2 km),Kevadia Bus Stand (2 km),No metro available,"Statue of Unity Airport, Kevadia (5 km)",8:00 AM - 6:00 PM (High-speed elevator: 9:00 AM - 5:00 PM),"₹120 (adults), ₹60 (children 3-15 years); High-speed elevator: ₹380 (adults), ₹230 (children)","October to March (pleasant weather, clear views)","Well-developed roads, wheelchair accessible, battery-operated vehicles available","Available in multiple languages, audio guides provided","Available, ₹30 for cars","Restaurants, food courts, souvenir shops, restrooms, tent city accommodation","World's tallest statue at 182m, Unity Glow Garden, River cruise, Jungle Safari available"
Gir National Park,Sasan,Wildlife Sanctuary / National Park,https://girlion.gujarat.gov.in/,https://en.wikipedia.org/wiki/Gir_National_Park,Junagadh Railway Station (65 km),Sasan Bus Stand (2 km),No metro available,Rajkot Airport (160 km),6:00 AM - 10:00 AM & 3:00 PM - 6:00 PM (Oct-June); Closed Mondays,"₹240 (Indians), ₹1,200 (foreigners); Vehicle charges: ₹600-1,500","December to March (cooler weather, better wildlife visibility)","Forest tracks, 4WD vehicles recommended, not wheelchair accessible","Mandatory forest guides provided, English and Gujarati speaking","Available at entry gates, ₹20-50","Forest rest houses, cafeterias, eco-shops, interpretive center","Only home to Asiatic lions, advance booking required, photography charges extra"
Somnath Temple,Somnath,Temple / Religious Site,https://somnath.org/,https://en.wikipedia.org/wiki/Somnath_temple,Somnath Railway Station (1 km),Somnath Bus Stand (1 km),No metro available,Rajkot Airport (140 km),"6:00 AM - 9:30 PM (Aarti: 7:00 AM, 12:00 PM, 7:00 PM)",Free entry,October to March (pleasant weather for temple visits),"Well-maintained roads, stairs to temple, wheelchair access limited","Local guides available, audio guides in multiple languages","Available, ₹10-20 for vehicles","Dharamshala, restaurants, souvenir shops, restrooms","First among 12 Jyotirlingas, sound and light show in evening, beachside location"
Rann of Kutch,Kutch,Natural Wonder / Cultural Tourism,https://www.gujarattourism.com/kutch/,https://en.wikipedia.org/wiki/Rann_of_Kutch,Bhuj Railway Station (80 km),Dhordo Village (5 km),No metro available,Bhuj Airport (85 km),6:00 PM - 10:00 PM (Rann Utsav period),₹25 per person for Rann area,"November to February (Rann Utsav season, full moon nights)","Special vehicles provided, temporary roads during festival","Cultural programs, camel rides, local craft demonstrations","Designated parking areas, included in tour packages","Tent accommodation, restaurants, craft villages, cultural centers","World's largest salt desert, Rann Utsav festival, full moon nights spectacular"
Sabarmati Ashram,Ahmedabad,Historical Monument / Museum,https://sabarmatiashram.org/,https://en.wikipedia.org/wiki/Sabarmati_Ashram,Ahmedabad Railway Station (8 km),Sabarmati Ashram Bus Stop (0.5 km),Sabarmati Metro Station (2 km),Sardar Vallabhbhai Patel Airport (15 km),8:30 AM - 6:30 PM (closed on Mondays),Free entry,October to March (pleasant weather for walking),"Well-paved paths, wheelchair accessible, guided walkways","Available in multiple languages, audio tours provided","Available, ₹10 for two-wheelers, ₹20 for cars","Museum shop, cafeteria, library, restrooms","Mahatma Gandhi's residence, Dandi March starting point, spinning wheel demonstrations"
Rani ki Vav,Patan,UNESCO World Heritage Site / Historical Monument,Not documented,https://en.wikipedia.org/wiki/Rani_ki_Vav,Mahesana Railway Station (30 km),Patan Bus Stand (2 km),No metro available,Sardar Vallabhbhai Patel Airport (125 km),8:00 AM - 6:00 PM,"₹40 (Indians), ₹600 (foreigners)",October to March (cooler weather for exploration),"Steps to descend, not wheelchair accessible","ASI guides available, multilingual support","Available, ₹10 for cars","Information center, restrooms, small shops","11th-century stepwell, UNESCO World Heritage Site, intricate carvings, flood-lit in evenings"
Dwarka Temple,Dwarka,Temple / Religious Site,https://dwarkadhish.org/,https://en.wikipedia.org/wiki/Dwarkadhish_Temple,Dwarka Railway Station (1 km),Dwarka Bus Stand (1 km),No metro available,Jamnagar Airport (137 km),6:30 AM - 12:30 PM & 5:00 PM - 9:30 PM,Free entry,"October to March (pleasant weather), Janmashtami festival","Well-connected roads, temple has stairs, limited wheelchair access","Local guides available, English and Hindi support","Available, ₹20 for cars","Dharamshala, restaurants, souvenir shops, restrooms","One of Char Dham pilgrimage sites, Krishna's legendary kingdom, beachside location"
Ahmedabad Heritage Walk Area,Ahmedabad,Heritage / Cultural Tourism,https://www.gujarattourism.com/,https://en.wikipedia.org/wiki/Old_City_(Ahmedabad),Ahmedabad Railway Station (3 km),Lal Darwaja Bus Stand (1 km),Shahpur Metro Station (1.5 km),Sardar Vallabhbhai Patel Airport (12 km),Heritage walk: 8:00 AM - 10:00 AM (Sunday to Friday),₹100 per person for guided heritage walk,October to March (comfortable walking weather),"Walking tour, some narrow lanes, limited wheelchair access","Expert heritage guides, English and Gujarati support","Street parking available, ₹10-20","Traditional eateries, craft shops, restrooms at major monuments","UNESCO World Heritage City, Pol houses, traditional architecture, street food experiences"
Gujarat Science City,Ahmedabad,Science Museum / Educational Tourism,https://sciencecity.gujarat.gov.in/,https://en.wikipedia.org/wiki/Gujarat_Science_City,Ahmedabad Railway Station (15 km),Science City Bus Stop (0.5 km),APMC Metro Station (3 km),Sardar Vallabhbhai Patel Airport (8 km),10:30 AM - 7:30 PM (closed on Mondays),"₹60 (adults), ₹40 (children); IMAX: ₹125 additional","Year-round (indoor facility), avoid summer afternoons","Modern infrastructure, wheelchair accessible, elevators available","Interactive exhibits, educational programs for groups","Ample parking, ₹20 for cars","Food court, gift shop, restrooms, energy park","Largest science center in India, IMAX theater, robotics gallery, space exhibits"
Marine National Park,Jamnagar,Marine National Park / Eco-Tourism,Not documented,"https://en.wikipedia.org/wiki/Marine_National_Park,_Gulf_of_Kutch",Jamnagar Railway Station (30 km),Jamnagar Bus Stand (30 km),No metro available,Jamnagar Airport (35 km),8:00 AM - 5:00 PM (boat trips tide-dependent),"₹25 (Indians), ₹300 (foreigners); Boat charges extra","October to March (calm seas, better weather)","Boat access required, not suitable for mobility-impaired visitors","Marine biologists, local fishermen guides","Available at jetty points, ₹15 for cars","Basic facilities at jetties, packed lunch recommended","India's first Marine National Park, coral reefs, mangroves, dolphin sightings possible"
Champaner-Pavagadh Archaeological Park,Champaner,UNESCO World Heritage Site / Historical Monument,Not documented,https://en.wikipedia.org/wiki/Champaner-Pavagadh_Archaeological_Park,Vadodara Railway Station (47 km),Champaner Bus Stand (2 km),No metro available,Vadodara Airport (50 km),Sunrise to Sunset; Kalika Temple: 5:00 AM - 10:00 PM,"₹25 (Indians), ₹300 (foreigners)",October to March (pleasant weather for trekking),"Hill climbing required, ropeway available for temple, moderate trekking","ASI guides available, local guides for temple trek","Available at base, ₹10 for cars","Rest house, small eateries, restrooms","UNESCO World Heritage Site, mix of Hindu and Islamic architecture, ropeway to Kalika Temple"
Palitana Temples,Palitana,Temple Complex / Religious Tourism,Not documented,https://en.wikipedia.org/wiki/Palitana_temples,Palitana Railway Station (5 km),Palitana Bus Stand (4 km),No metro available,Bhavnagar Airport (55 km),5:30 AM - 7:00 PM (varies by season),Free entry,October to March (cooler weather for climbing),"3,500 steps climb, doli (palanquin) service available, not wheelchair accessible","Local Jain guides available, religious significance explained","Available at base, ₹15 for cars","Dharamshala, vegetarian restaurants, basic medical aid","Sacred Jain pilgrimage site, 863 temples on Shatrunjaya Hill, no food/water allowed on hill after sunset"
Saputara Hill Station,Dang District,Hill Station / Eco-Tourism,https://www.gujarattourism.com/saputara/,https://en.wikipedia.org/wiki/Saputara,Bilimora Railway Station (60 km),Saputara Bus Stand (1 km),No metro available,Surat Airport (85 km),Open 24/7 (individual attractions have specific timings),No entry fee for hill station; Lake garden: ₹10,June to February (monsoon and post-monsoon),"Mountain roads, good connectivity, some attractions wheelchair accessible","Local tribal culture tours, nature walks available","Available throughout, ₹10-20 for cars","Hotels, resorts, restaurants, ropeway, boating","Only hill station in Gujarat, tribal culture, Artist Village, monsoon destination"
Adalaj Stepwell,Gandhinagar,Historical Monument / Architectural Site,Not documented,https://en.wikipedia.org/wiki/Adalaj_Stepwell,Kali Gandhi Marg Railway Station (15 km),Adalaj Bus Stand (1 km),Adalaj Metro Station (2 km),Sardar Vallabhbhai Patel Airport (25 km),Sunrise to Sunset,Free entry,October to March (pleasant weather for exploration),"Steps to descend, not wheelchair accessible, good lighting","ASI guides available on request, information boards present","Available, ₹10 for cars","Small shops, restrooms, interpretation center","15th-century Indo-Islamic architecture, five-story stepwell, intricate carvings, natural cooling system"
Blackbuck National Park,Velavadar,National Park / Wildlife Sanctuary,Not documented,"https://en.wikipedia.org/wiki/Blackbuck_National_Park,_Velavadar",Bhavnagar Railway Station (45 km),Velavadar Bus Stand (2 km),No metro available,Bhavnagar Airport (50 km),6:00 AM - 6:00 PM,"₹25 (Indians), ₹200 (foreigners); Camera: ₹25","October to March (wildlife active, pleasant weather)","Safari vehicles available, grassland terrain, wheelchair accessible vehicles on request","Forest guides mandatory, English and Gujarati support","Available at entry gate, ₹10 for cars","Forest rest house, basic canteen, restrooms","Largest population of blackbucks in India, harrier eagles, wolf sightings possible"
Vadodara (Baroda),Vadodara,Cultural Tourism / Historical City,https://www.gujarattourism.com/vadodara/,https://en.wikipedia.org/wiki/Vadodara,Vadodara Junction (city center),Central Bus Stand (2 km),No metro available,Vadodara Airport (8 km),Varies by attraction,Laxmi Vilas Palace: ₹150; Museums: ₹10-50,October to March (pleasant weather for sightseeing),"Well-developed city, most attractions accessible","City tours available, heritage walks organized","Available throughout city, ₹10-30 per location","Hotels, restaurants, shopping malls, medical facilities","Cultural capital of Gujarat, Laxmi Vilas Palace, Sayaji Baug, MS University, Baroda Museum"
Lothal Archaeological Site,Bhal,Archaeological Site / Historical Monument,Not documented,https://en.wikipedia.org/wiki/Lothal,Lothal-Bhurkhi Railway Station (6 km),Lothal Village (1 km),No metro available,Sardar Vallabhbhai Patel Airport (80 km),9:00 AM - 5:00 PM (closed on Fridays),"₹25 (Indians), ₹300 (foreigners)",October to March (comfortable weather for site exploration),"Walking required, uneven surfaces, not wheelchair accessible","ASI guides available, museum with detailed explanations","Limited parking, ₹5 for cars","Museum, basic refreshments, restrooms","4,500-year-old Harappan civilization site, ancient dockyard, bead-making factory, maritime heritage"
Girnar Hills,Junagadh,Religious Site / Trekking / Hill Station,Not documented,https://en.wikipedia.org/wiki/Girnar,Junagadh Railway Station (8 km),Junagadh Bus Stand (8 km),No metro available,Rajkot Airport (102 km),4:00 AM - 8:00 PM; Ropeway: 8:00 AM - 6:00 PM,Free for temples; Ropeway: ₹250 (round trip),October to March (cooler weather for trekking),"10,000 steps trek, ropeway available to Ambaji Temple, moderate to difficult trekking",Local guides available for religious significance,"Available at base, ₹15 for cars","Dharamshala, food stalls, medical aid, restrooms","Five mountain peaks, multiple Jain and Hindu temples, Ropeway to Ambaji Temple, panoramic views"
Mandvi Beach,Kutch,Beach / Coastal Tourism,Not documented,https://en.wikipedia.org/wiki/Mandvi,Gandhidham Railway Station (60 km),Mandvi Bus Stand (2 km),No metro available,Bhuj Airport (60 km),Open 24/7 (best visited during daylight),Free entry,"October to March (pleasant weather, calm seas)","Beach accessible by road, some areas wheelchair accessible","Boat rides available, local fishermen guides","Available near beach, ₹10 for cars","Beach resorts, restaurants, water sports, camel rides","White sand beach, Vijay Vilas Palace nearby, water sports activities, ship-building heritage"
Nalsarovar Bird Sanctuary,Ahmedabad,Bird Sanctuary / Eco-Tourism,Not documented,https://en.wikipedia.org/wiki/Nalsarovar_Bird_Sanctuary,Viramgam Railway Station (30 km),Nalsarovar Village (5 km),No metro available,Sardar Vallabhbhai Patel Airport (65 km),6:00 AM - 6:00 PM,"₹20 (Indians), ₹150 (foreigners); Boat charges: ₹500-1000",November to February (migratory season),"Observation towers accessible, walking trails, wheelchairs manageable on main paths","Local boatmen with bird knowledge, binoculars available","Available at jetty, ₹10 for cars","Forest rest house, basic canteen, bird watching towers","Largest wetland bird sanctuary in Gujarat, 250+ bird species, flamingo sightings, migratory birds"
Little Rann of Kutch (Wild Ass Sanctuary),Surendranagar,Wildlife Sanctuary / Eco-Tourism,https://forests.gujarat.gov.in/wild-ass-sanctuary.htm,https://en.wikipedia.org/wiki/Indian_Wild_Ass_Sanctuary,Viramgam Railway Station (45 km),Dasada Bus Stand (8 km),No metro available,Sardar Vallabhbhai Patel Airport (120 km),6:00 AM - 6:00 PM (October to June; closed during monsoons),"₹25 (Indians), ₹200 (foreigners); Safari vehicle: ₹1,500-2,500","October to March (wild ass active, pleasant weather)","4WD vehicles required, salt flat terrain, not wheelchair accessible","Mandatory forest guides, wildlife expertise provided","Available at entry points, ₹15 for cars","Desert resorts, eco-lodges, basic restaurants","Only home to endangered Asiatic wild ass, largest wildlife sanctuary in India (4,953 sq km), salt flats, flamingo colonies"
Modhera Sun Temple,Mehsana,Historical Temple / Archaeological Site,Not documented,https://en.wikipedia.org/wiki/Modhera_Sun_Temple,Mehsana Railway Station (25 km),Modhera Bus Stand (1 km),No metro available,Sardar Vallabhbhai Patel Airport (105 km),Sunrise to Sunset; Sound & Light Show: 7:30 PM - 8:30 PM,"₹25 (Indians), ₹300 (foreigners); Light Show: ₹50 additional","October to March (pleasant weather), Makar Sankranti festival","Well-maintained complex, some steps, limited wheelchair access","ASI guides available, audio guides in multiple languages","Available, ₹10 for cars","Interpretation center, cafeteria, souvenir shop, restrooms","11th-century Sun Temple, no shadow at noon during equinox, intricate stone carvings, Pushkarni (stepped tank)"
Diu Island,Diu (Union Territory),Beach / Island Tourism,https://www.gujarattourism.com/diu/,"https://en.wikipedia.org/wiki/Diu,_India",Veraval Railway Station (90 km),Diu Bus Stand (city center),No metro available,Diu Airport (8 km),Open 24/7 (individual attractions have specific hours),Free entry to beaches; Fort: ₹25,"October to March (pleasant weather, calm seas)","Bridges connect to mainland, beaches accessible, some heritage sites have stairs","Local guides for heritage walks, water sports operators","Available throughout, ₹10-20 for cars","Beach resorts, restaurants, bars, water sports, churches","Portuguese heritage, alcohol permitted, pristine beaches, Diu Fort, St. Paul's Church, water sports hub"
Porbandar (Kirti Mandir),Porbandar,Historical Site / Birthplace Tourism,Not documented,https://en.wikipedia.org/wiki/Porbandar,Porbandar Railway Station (3 km),Porbandar Bus Stand (2 km),No metro available,Porbandar Airport (4 km),Kirti Mandir: 9:00 AM - 12:00 PM & 4:00 PM - 7:00 PM,Free entry,October to March (pleasant weather),"City location, well-connected roads, wheelchair accessible",Local guides for Gandhi heritage sites,"Street parking available, ₹10-20","Hotels, restaurants, museums, beach, market","Mahatma Gandhi's birthplace, Kirti Mandir (birth house museum), Sudama Temple, coastal town, Porbandar Beach"
Bhuj City & Kutch Museum,Kutch,Cultural Tourism / Museum,https://www.gujarattourism.com/kutch/bhuj/,https://en.wikipedia.org/wiki/Bhuj,Bhuj Railway Station (2 km),Bhuj Bus Stand (1 km),No metro available,Bhuj Airport (4 km),Museums: 9:00 AM - 12:00 PM & 3:00 PM - 6:00 PM (closed Wednesdays),Kutch Museum: ₹15; Aina Mahal: ₹30,October to March (pleasant weather for exploration),"City center, most attractions accessible, some heritage sites have steps","Cultural heritage guides, craft village tours available","Available throughout city, ₹10-30 per location","Hotels, traditional restaurants, craft markets, hospitals","Earthquake-rebuilt city, oldest museum in Gujarat, Aina Mahal (Hall of Mirrors), traditional handicrafts, gateway to Rann of Kutch"
Shoolpaneshwar Wildlife Sanctuary,Narmada,Wildlife Sanctuary / River Tourism,Not documented,https://en.wikipedia.org/wiki/Shoolpaneshwar_Wildlife_Sanctuary,Kevadia Colony Station (25 km),Kevadia Bus Stand (25 km),No metro available,Statue of Unity Airport (30 km),6:00 AM - 6:00 PM,"₹20 (Indians), ₹200 (foreigners); Camera: ₹25","October to March (wildlife active, river cruise season)","Forest roads, boat access for some areas, moderate trekking required","Forest guides available, tribal village visits","Available at entry points, ₹10 for cars","Forest rest house, eco-tourism facilities, tribal crafts center","Narmada River sanctuary, tribal culture, river cruises, sloth bears, leopards, endangered species conservation"
Thol Bird Sanctuary,Mehsana,Bird Sanctuary / Wetland,Not documented,https://en.wikipedia.org/wiki/Thol_Bird_Sanctuary,Kalol Railway Station (25 km),Thol Village (2 km),No metro available,Sardar Vallabhbhai Patel Airport (40 km),6:00 AM - 6:00 PM,"₹15 (Indians), ₹150 (foreigners)",November to February (migratory season),"Observation towers accessible, walking trails, wheelchairs manageable on main paths","Bird watching guides available, binoculars for rent","Available at entrance, ₹10 for cars","Visitor center, basic refreshments, restrooms","Important wetland ecosystem, 320+ bird species recorded, flamingo roosting site, photography paradise"
Ambaji Temple,Banaskantha,Temple / Religious Tourism,https://ambajimaa.com/,https://en.wikipedia.org/wiki/Ambaji,Abu Road Railway Station (45 km),Ambaji Bus Stand (1 km),No metro available,Udaipur Airport (65 km),5:00 AM - 10:30 PM,Free entry; Ropeway: ₹80 (round trip),"October to March (pleasant weather), Navratri festival","Temple accessible, ropeway to Gabbar Hill, stairs at main temple","Religious guides available, pilgrimage group tours","Available, ₹20 for cars","Dharamshala, restaurants, shops, medical facilities","One of 51 Shakti Peethas, Gabbar Hill ropeway, Ambaji Fair, border with Rajasthan"
Pavagadh Archaeological Park & Kalika Temple,Panchmahal,UNESCO World Heritage Site / Religious Site,Not documented,https://en.wikipedia.org/wiki/Champaner-Pavagadh_Archaeological_Park,Vadodara Railway Station (47 km),Champaner Bus Stand (8 km),No metro available,Vadodara Airport (50 km),Archaeological Park: 8:00 AM - 5:00 PM; Temple: 5:00 AM - 10:00 PM,"Park: ₹25 (Indians), ₹300 (foreigners); Ropeway: ₹112 (round trip)","October to March (pleasant weather), Navratri","Ropeway available, trekking option (2.5 km), not wheelchair accessible for hill temple","ASI guides for archaeological sites, religious guides for temple","Available at base and ropeway station, ₹15 for cars","Restaurants, dharamshala, shops, first aid","UNESCO World Heritage Site, 600m elevation, panoramic views, mix of Hindu-Islamic architecture"
Junagadh City & Uparkot Fort,Junagadh,Historical City / Fort,Not documented,https://en.wikipedia.org/wiki/Junagadh,Junagadh Railway Station (city center),Junagadh Bus Stand (1 km),No metro available,Rajkot Airport (102 km),Fort: Sunrise to Sunset; Museums: 9:00 AM - 12:00 PM & 3:00 PM - 6:00 PM,Fort: ₹15; Durbar Hall Museum: ₹10,October to March (pleasant weather for exploration),"Some areas wheelchair accessible, fort has uneven terrain","Local heritage guides available, historical significance explained","Available at fort entrance, ₹10 for cars","Hotels, restaurants, markets, hospitals","2300-year-old fort, stepwells, Buddhist caves, Mahabat Maqbara mausoleum, Edicts of Ashoka"
