Place,Type,District,Official Website,Wikipedia,Nearest Railway Station,Nearest Bus Stand,Nearest Metro Station,Nearest Airport,Timings,Entry Fee,Best Time to Visit,Accessibility,Guided Tours,Parking,Nearby Amenities,Special Notes
Loktak Lake,Natural spot / Lake / Eco-tourism,Bishnupur / Imphal,https://www.loktaklake.in/,https://en.wikipedia.org/wiki/Loktak_Lake,Jiribam — ~215 km; Dimapur (Nagaland) — ~215 km,Moirang Town bus stand — ~3 km,No metro available,Imphal Airport — ~50-60 km,8:00 AM – 6:00 PM,No fixed lake entry fee; boat rides/stays have charges,Oct–Mar (winter season),Road access via Moirang; floating islands require boat,"Local boat operators, homestays arrange tours",At lake shores / tourist home / resort areas,"Homestays, resorts on Thanga or Sendra islands; cafeterias",Unique for its floating phumdis (biomass); adjacent to Keibul Lamjao National Park
Keibul Lamjao National Park,Wildlife Sanctuary / National Park,Bishnupur District,https://www.loktaklake.in/keibul-lamjao,https://en.wikipedia.org/wiki/Keibul_Lamjao_National_Park,Jiribam — ~225 km; Dimapur (Nagaland) — ~225 km,Moirang bus stand — ~12 km,No metro available,Imphal Airport — ~55 km,9:00 AM – 5:30 PM,"₹20 Indians, ₹200 foreigners (approx.)",Nov–Mar (dry season),"Jeep safari, guided walks on floating biomass; not wheelchair-friendly",Forest guides available (mandatory),Limited at entry gate,"Loktak homestays, eco huts, shops",World’s only floating national park; habitat of the endangered Sangai (“dancing deer”)
Kangla Fort,Historical Fort / Archaeological site,Imphal,https://kanglafortmanipur.nic.in/,https://en.wikipedia.org/wiki/Kangla_Fort,Jiribam — ~225 km,Imphal ISBT — ~4 km,No metro available,Imphal International Airport — ~7 km,9:00 AM – 4:30 PM,₹10–₹20,Oct–Apr,Road accessible; walking inside fort; not fully wheelchair-friendly,Available at gate; English-speaking guides,Paid parking near entrance,"Museum, shops, eateries nearby","Seat of Manipur’s former kingdom; includes temples, relics, and INA Museum section"
Shree Shree Govindajee Temple,Religious / Temple (Hindu),Imphal,Not documented,https://en.wikipedia.org/wiki/Shree_Govindajee_Temple,Jiribam — ~225 km; Dimapur (Nagaland) — ~215 km,ISBT Imphal — ~7 km,No metro available,Imphal International Airport — ~8 km,5:00 AM – 12:00 PM; 4:00 PM – 9:00 PM,Free,Oct–Apr (festivals like Holi celebrated with grandeur),Easily accessible by road; temple has steps (not fully wheelchair-friendly),Local priests & guides available,"Available near temple, free/nominal fee","Markets, hotels, eateries around Imphal",Historic 19th-century temple patronized by Manipur’s royal family
Khongjom War Memorial Complex,Historical Monument / War Memorial,Thoubal District,Not documented,Not documented,Dimapur (Nagaland) is nearest major railhead; local connectivity by road from Imphal,Local bus to Thoubal; then onward local transport to Khongjom,No metro available,Imphal Airport — ~30-40 km,10:00 AM – 4:00 PM,Not documented,Oct–Mar; also on April 23 (Khongjom Day),Road access; some walking; hillock; moderate,Local guides / tourism department available,Available near memorial; basic facilities,"Shops / tea stalls, restrooms; lodging in nearby towns",Commemorates the Battle of Khongjom (1891) and Major Paona Brajabashi
Sekta Archaeological Living Museum,Archaeological / Museum / Cultural-Heritage,"Sekta Village, Imphal East",Not documented,https://en.wikipedia.org/wiki/Sekta_Archaeological_Living_Museum,Similar to others; likely Dimapur as major point; local roads from Imphal,Bus to Sekta via Imphal East local buses,No metro available,Imphal Airport — road transfer needed,Not documented,Not documented,Dry season (Oct-March),Walking across archaeological mounds; not wheelchair-friendly likely,When arranged via State Archaeology Dept / local guides,Basic near village; not large structured parking,"Nearby villages, simple lodging / food; restrooms basic",Known for the excavation of burial mounds; “living museum” concept
Manipur Zoological Garden,Zoo / Wildlife Conservation,"Iroisemba, Imphal West",Not documented,https://en.wikipedia.org/wiki/Manipur_Zoological_Garden,You would use Dimapur + road or nearest local station,"In Imphal, local buses / taxis to Iroisemba",No metro available,Imphal Airport — within city / short drive,9:00 AM – 5:00 PM (exact hours not documented),Not documented,Summer months and dry season; early day for active animals,Well maintained paths; enclosures; walkable; may be partial for wheelchairs,Zoo staff / local guides may explain animals,Likely available near zoo entrance; charges small / not clearly documented,"Restrooms, refreshment stalls; shops; hotels in Imphal",Houses rare and endangered species including Sangai; important for conservation
INA Martyrs’ Memorial Complex (INA Museum),War Memorial / Museum / Historical Monument,"Moirang, Bishnupur",https://inamuseum.mn.gov.in/,https://en.wikipedia.org/wiki/INA_Martyrs%27_Memorial_Complex,Nearest major via road (Imphal to Moirang); local stations are minor,Moirang town; buses / taxis from Imphal,No metro available,Imphal Airport — ~45-50 km by road,9:00 AM-5:00 PM (need verification),Not clearly documented in public sources,Dry season (Oct–Mar),Well constructed complex; walking paths; some climbing small elevations; not all sections wheelchair-friendly,Museum guides likely available; local guides for historical context,Parking available at complex; basic facilities,Lodging in Moirang; food shops; restrooms,Moirang is significant because INA first hoisted Indian flag under Netaji in Moirang in 1944
Dzüko Valley,Valley / Trekking / Natural Spot,Senapati (Manipur–Nagaland border),Not documented,https://en.wikipedia.org/wiki/Dz%C3%BCko_Valley,Nearest major stations would be in Nagaland / Dimapur side,Local towns near Senapati district & border regions,No metro available,Imphal Airport + road to border areas; or using Nagaland side airports,Trek accessible in daylight; camps night stay for trekkers,Not documented (some trekking permit may be needed),Apr–Jun & Sep–Oct for flowers,Trekking required; moderate to difficult; physically demanding; not wheelchair friendly,Local trekking groups/guides; organizers especially from Kohima or Imphal/Bordertown,At trailheads / base camps; basic,"Camping huts, tents; small village shops; limited lodging near base camps",Famous trekking valley; “valley of flowers” seasonal bloom; fragile ecosystem
Andro Village,Heritage Village / Cultural Tourism,Imphal East,Not documented,Not documented,Jiribam — ~220 km,Imphal ISBT — ~25 km,No metro available,Imphal International Airport — ~25 km,Daylight hours,₹20–₹50 (heritage complex),Oct–Apr,Road accessible; village lanes walkable,Local community guides available,Available at village entrance,"Homestays, eco-huts, local eateries","Famous for traditional pottery, local brew, and cultural museum"
Sadu Chiru Waterfalls,Waterfall / Nature spot,"Leimaram, Manipur",Not documented,Not documented,Jiribam — ~200 km,Bishnupur bus stand — ~15 km,No metro available,Imphal International Airport — ~35 km,8:00 AM – 5:00 PM,₹20–₹50,Jun–Sep (full flow),Short hike required from parking; not wheelchair-friendly,Local guides not necessary,Available near entry gate,"Small stalls, rest spots",Picturesque falls surrounded by dense forests — picnic spot
Zeilad Lake & Zeilad Wildlife Sanctuary,Lake / Wildlife Sanctuary / Eco-tourism,Tamenglong,Not documented,Not documented,Jiribam — ~150 km,Tamenglong bus stand — ~25 km,No metro available,Imphal International Airport — ~200 km,Daylight hours,Not documented (may vary for wildlife entry),Oct–Mar,Mountain roads; trekking inside sanctuary (moderate),Forest guides recommended,Limited near entry points,"Eco huts, small shops in Tamenglong town","Known for migratory birds, local legends, and scenic landscape"
Khonghampat Orchidarium,Orchid Garden / Botanical reserve,Imphal West,Not documented,Not documented,Jiribam — ~220 km,Imphal ISBT — ~10 km,No metro available,Imphal International Airport — ~12 km,9:00 AM – 4:00 PM,₹20–₹30,Mar–Apr (orchids in bloom),Road accessible; garden paths walkable,Available with horticulture staff,Available near gate,"Restrooms, small stalls",Maintains 110+ rare orchid species native to Manipur
Sirohi National Park,National Park / Wildlife / Trekking,Ukhrul,Not documented,https://en.wikipedia.org/wiki/Sirohi_National_Park,Jiribam — ~250 km,Ukhrul bus stand — ~20 km,No metro available,Imphal International Airport — ~100 km,Sunrise to sunset,Not documented (may require local permits),Apr–Jun (Siroi lily in bloom),Mountain treks required; not wheelchair-friendly,Forest guides & local tribes provide eco-tours,Limited village parking,"Eco huts, homestays in Ukhrul",Only habitat of the rare Siroi lily (Lilium mackliniae) — state flower of Manipur
Khangkhui Caves,Limestone Caves / Archaeological site,Ukhrul,Not documented,https://en.wikipedia.org/wiki/Khangkhui_Cave,Jiribam — ~250 km,Ukhrul bus stand — ~15 km,No metro available,Imphal International Airport — ~95 km,9:00 AM – 4:00 PM,₹20–₹30,Nov–Apr,Short trek to cave; inside paths slippery — not wheelchair-friendly,Local guides recommended,Limited village parking,Basic shops & stalls,Known as “Khangkhui Mangsor”; Paleolithic remains found
Tharon Cave,Limestone cave / Archaeological site,Tamenglong,Not documented,Not documented,Jiribam — ~150 km,Tamenglong bus stand — ~30 km,No metro available,Imphal International Airport — ~185 km,9:00 AM – 4:00 PM,Not documented (may require local permission),Oct–Mar,Road + short trek; cave exploration moderate difficulty,Essential — local guides required,Limited near village base,"Shops, eco huts in Tamenglong",Prehistoric significance; 5 km long cave with multiple chambers
Willong Khullen,Heritage Village / Monolith site,Senapati,Not documented,Not documented,Dimapur — ~110 km,Senapati town — ~35 km,No metro available,Imphal International Airport — ~120 km,Daylight hours,Not documented,Nov–Apr,Hilly road; village paths walkable,Local tribal guides available,Roadside village parking,"Homestays, small shops",Known as “Stonehenge of Manipur” — village of giant standing monoliths tied to tribal rituals
Manipur State Museum,Museum / Cultural & historical exhibits,Imphal,Not documented,https://en.wikipedia.org/wiki/Manipur_State_Museum,Jiribam — ~225 km,Imphal ISBT — ~3 km,No metro available,Imphal International Airport — ~6 km,10:00 AM – 4:30 PM (Closed on Mondays & holidays),"₹10 adults, ₹5 children",Year-round,Fully road accessible; building partially wheelchair-friendly,Museum guides available,Available near gate,"Cafes, shops, government guest houses nearby","Exhibits rare manuscripts, tribal ornaments, costumes, royal artifacts, and zoological specimens"
