Place,Location,Type,Official Website,Wikipedia,Nearest Railway Station,Nearest Bus Stand,Nearest Metro Station,Nearest Airport,Timings,Entry Fee,Best Time to Visit,Accessibility,Guided Tours,Parking,Nearby Amenities,Special Notes
Meenakshi Amman Temple,Madurai (Tamil Nadu),Temple,Not documented,https://en.wikipedia.org/wiki/Meenakshi_Amman_Temple,Madurai Junction,Periyar Bus Stand (Madurai),No metro available,Madurai Airport,Generally early morning until late evening with breaks for rituals (specific puja/timing windows vary by season) — Not documented precisely,No general entry fee; special darshan/queue passes may carry fees — Not documented,October–March,City roads; large complex with many steps and crowds; partial wheelchair access in some areas but crowded — check locally for specific facilities,"Local guides available (Tamil, English common)",Temple-managed parking + nearby paid lots; charges vary — Not documented,"Plenty of restaurants, lodging (budget to premium), shops for religious items, public restrooms around the temple precincts",One of southern India’s most famous goddess temples; centuries-old architecture and vibrant festival tradition; heavy crowds during festivals.
Brihadeeswarar Temple,Thanjavur (Tamil Nadu),Historical Monument / Temple,Not documented,https://en.wikipedia.org/wiki/Brihadisvara_Temple,Thanjavur Junction,Thanjavur Central Bus Stand,No metro available,Tiruchirappalli International Airport (Trichy),Typically morning to evening (exact hours vary; often ~6:00–12:00 and 16:00–19:00) — Not documented precisely,Temple complex usually has no general entry fee; some guided/heritage services may charge — Not documented,October–March,Well connected by road; temple has steps and heritage structures — wheelchair access limited in core sanctum areas,Local guides and archaeology/heritage tours available (Tamil/English),Nearby public/paid parking in Thanjavur city — charges vary — Not documented,"Hotels, restaurants, handicraft shops, museums (Thanjavur Maratha Palace & Art Gallery nearby)","Major Chola-era temple, part of UNESCO Great Living Chola Temples; architectural marvel with large vimana (tower)."
Mahabalipuram / Mamallapuram,Kancheepuram District (Tamil Nadu),Historical Monuments / Beach / UNESCO-linked group,https://www.tamilnadutourism.tn.gov.in/destinations/mahabalipuram,https://en.wikipedia.org/wiki/Mahabalipuram,Chengalpattu or Egattur / Chennai stations,Mahabalipuram Bus Stand,No metro available,Chennai International Airport,Individual monuments/park timings often ~ sunrise–sunset; specific museums may have set hours — Not documented precisely,Entry fees apply for certain monuments/archaeological sites (ASIs/heritage sites) — Not documented precisely,November–February,Good road access via East Coast Road (ECR); monuments have steps and rocky terrain — variable wheelchair accessibility,Local guides (English/Tamil) and heritage walks available; many organized day-trips from Chennai,Public parking in town; private parking at larger hotels and monument car parks — charges vary — Not documented,"Restaurants, cafes, guesthouses, resorts, souvenir shops, restrooms","Famous for shore temple, Pancha Rathas, rock-cut bas-reliefs (Descent of the Ganges), UNESCO heritage value (group of monuments), popular day-trip from Chennai."
Ooty (Udhagamandalam),Nilgiris District (Tamil Nadu),Hill Station / Botanical gardens / Lakes / Nilgiri Mountain Railway,Not documented,https://en.wikipedia.org/wiki/Ooty,Udhagamandalam (Ooty),Ooty Bus Stand (Gandhigram),No metro available,Coimbatore International Airport,"Attractions (Botanical Garden, lake) have set opening hours — Not documented precisely",Botanical Garden / museums may have small entry fees — Not documented precisely,March–June; October–February,"Hill roads, winding but well maintained; many viewpoints require short walks/steps — partial wheelchair access in limited areas","Local guides and tour operators (English/Tamil) for tea estates, nature walks",Hotel and public parking available; charges vary — Not documented,"Hotels/resorts, cafés, restaurants, shops, trekking operators","Famous colonial-era hill station, tea gardens, Nilgiri Mountain Railway (UNESCO tentative/heritage-noted), scenic viewpoints."
Kodaikanal,Dindigul District (Tamil Nadu),Hill Station / Lakes / Waterfalls,Not documented,https://en.wikipedia.org/wiki/Kodaikanal,Kodai Road Railway Station (Kodaikanal Road),Kodaikanal Bus Stand,No metro available,Madurai Airport,"Parks, lake boating hours governed locally — Not documented precisely",Boating and some park entries have fees — Not documented precisely,October–March,Hill roads; many viewpoints require walking/steps; limited wheelchair access in core tourist spots,"Local guides/tour operators available (English, Tamil)",Public and hotel parking — charges vary — Not documented,"Restaurants, cafes, lodging, shops, medicinal plant stores","Princess of Hill Stations; famous for Kodaikanal Lake, Coaker's Walk, Bryant Park, and nearby waterfalls."
Ramanathaswamy Temple,Rameswaram (Tamil Nadu),Temple / Pilgrimage,Not documented,https://en.wikipedia.org/wiki/Ramanathaswamy_Temple,Rameswaram Railway Station,Rameswaram Bus Stand,No metro available,Madurai Airport,Temple opens early morning and closes late evening (ritual timings vary); exact daily schedule: Not documented,No general entry fee; certain rituals/scarlet services may have charges — Not documented,October–March,Rameswaram is on Pamban Island accessible via road and rail (Pamban bridge); temple has long corridors and many steps — partial accessibility for mobility-impaired but long walking distances inside complex,Local guides available; pilgrim services common (Tamil/English),Town parking available; small fees locally — Not documented,"Lodging, restaurants, shops for religious paraphernalia, pilgrim amenities",One of the holiest Shiva temples; famed for ornate corridors and sacred tanks; part of Char Dham pilgrimage tradition for many.
Vivekananda Rock Memorial & Thiruvalluvar Statue,Kanyakumari (Tamil Nadu),Memorials / Cultural Monuments / Seaside viewpoint,Not documented,https://en.wikipedia.org/wiki/Vivekananda_Rock_Memorial,Nagercoil Junction / Kanyakumari Railway Station,Kanyakumari Bus Stand,No metro available,Trivandrum International Airport (Thiruvananthapuram),Ferry services run during daytime (subject to sea & weather conditions); monument visiting hours follow ferry schedule — Not documented precisely,Ferry charge to Vivekananda Rock & Thiruvalluvar varies (small passenger ferry fee) — Not documented precisely,October–March,Access by ferry; walking on the rock memorial areas; recent infrastructure (including a glass bridge reported) — check local advisories,Local guides available in town; many package tours include Kanyakumari viewpoint at sunrise/sunset,Public parking in Kanyakumari town; charges vary — Not documented,"Hotels, seafood restaurants, souvenir shops, restrooms",Southernmost tip of mainland India; spectacular sunrise & sunset views; cultural monuments and new pedestrian infrastructure (glass bridge) reported recently.
Marina Beach,Chennai (Tamil Nadu),Urban Beach / Public Promenade,Not documented,https://en.wikipedia.org/wiki/Marina_Beach,Chennai Beach Railway Station,Many city bus stops along the beachfront; nearest major: Egmore/Chennai Mofussil bus stands,No direct metro along entire stretch,Chennai International Airport,Public beach; open 24 hours (individual attractions along the beach may have timings). Swimming discouraged/illegal in many areas due to currents.,Free (public beach),November–February,Road access good; wide promenades in parts with ramps (some wheelchair access) but sand & crowding limit mobility in many stretches,Not typical for the beach itself; city tours include Marina as a stop,Several public parking lots and paid zones near the promenade — charges vary,"Food stalls, cafes, lifeguard/police patrol; restrooms at some points, nearby hotels & tourist services","One of the longest urban beaches; popular for walks, public events and memorials along the shore."
Hogenakkal Falls,Dharmapuri District (Tamil Nadu),Waterfall / River gorge (Cauvery) / Boating (coracle rides),Not documented,https://en.wikipedia.org/wiki/Hogenakkal_Falls,Pennagaram/Dharmapuri area stations; Dharmapuri Railway Station,Hogenakkal bus services from Dharmapuri/Bengaluru via bus; local bus stand at Hogenakkal village,No metro available,Bengaluru International Airport or Salem Airport,Daytime visiting hours (sunrise–sunset); boating times subject to weather/water levels — Not documented precisely,Park/boat charges for coracle rides apply (local rates) — Not documented precisely,December–March & post-monsoon when flows are scenic; monsoon may be hazardous for boating,Rocky uneven terrain; trekking/steps; not wheelchair-friendly in core waterfall areas,Local boatmen/guides for coracle rides (Tamil / some English),Local parking near entry; small fees generally — Not documented,"Snack stalls, local eateries, basic lodging in nearby towns, restrooms",Known as 'Niagara of India' locally; coracle rides and medicinal oil massage stalls nearby — check safety advisories during heavy flow.
Mudumalai National Park / Wildlife Sanctuary,The Nilgiris / Erode / Tamil Nadu region,Wildlife Sanctuary / National Park (part of Nilgiri Biosphere),Not documented,https://en.wikipedia.org/wiki/Mudumalai_National_Park,Mysuru / Mettupalayam / Ooty approaches depending on entry gate,"Local bus stands at nearby towns (Masinagudi, Theppakadu)",No metro available,Coimbatore International Airport / Mysuru Airport,Safari timings set by park authorities (morning & afternoon slots) — Not documented precisely,Park/safari fees apply (per vehicle / per person); permits required — Not documented precisely,October–May,Forest roads; 4x4 vehicle safaris; limited wheelchair accessibility in core forest areas,Park-run and private guided safaris (English/Tamil) available; advance booking often required,Provided near park gates — Not documented precise charges,"Forest rest houses, private resorts, basic eateries; visitor centres at main gates","Part of Nilgiri Biosphere Reserve; good for elephants, tigers (rare), deer and birdlife — check park notifications for closures and permit procedures."
Vedanthangal Bird Sanctuary,Chengalpattu District (Tamil Nadu),Bird Sanctuary / Wetland,Not documented,https://en.wikipedia.org/wiki/Vedanthangal_Bird_Sanctuary,Chengalpattu Junction / local stations nearer,Vedanthangal bus access from Chengalpattu / nearby towns,No metro available,Chennai International Airport,Sanctuary hours typically daytime only (sunrise–sunset) — Not documented precisely,Small entry fee for visitors (state rates) — Not documented precisely,November–March,Flat wetland trails and watchtowers; relatively accessible though boardwalks and steps exist — partial wheelchair access in some viewing areas?,Local bird guides / nature guides available (Tamil/English),Small parking at sanctuary entrance — Not documented,"Small eateries in nearby villages, restrooms at entrance, limited lodging in larger towns nearby",
Yercaud,Salem District (Tamil Nadu),Hill Station,Not documented,https://en.wikipedia.org/wiki/Yercaud,Salem Junction,Yercaud Bus Stand (town centre),No metro available,"Salem Airport, Tiruchirappalli",Open year-round,Free (individual attractions may charge small fees),October–June,Winding hill roads; generally well maintained,Local guides & cabs available,"Available at viewpoints, charges vary","Hotels, restaurants, cafes","Known as the “Poor Man’s Ooty”; famous for Yercaud Lake, Pagoda Point, Lady’s Seat."
Courtallam (Kutralam) Falls,Tenkasi District (Tamil Nadu),Waterfalls / Health tourism,Not documented,https://en.wikipedia.org/wiki/Courtallam,Tenkasi Junction,Courtallam Bus Stand,No metro available,Tuticorin Airport,"Daytime, seasonal (June–September best for waterfalls)",Free (bathing areas may have charges),Monsoon (June–September),Road access good; slippery rocks near waterfalls,Not required; local guides available,"Local parking, charges nominal","Lodging, food stalls, Ayurvedic centres",Known as “Spa of South India” due to therapeutic waterfalls.
Annamalaiyar Temple,Tiruvannamalai (Tamil Nadu),Temple (Shaivite pilgrimage),Not documented,https://en.wikipedia.org/wiki/Annamalaiyar_Temple,Tiruvannamalai Railway Station,Tiruvannamalai Bus Stand,No metro available,Chennai Airport,Early morning to late night; rituals vary,Free; special darshan tickets available,Karthigai Deepam festival (Nov–Dec); generally Oct–Mar for weather,"City roads; temple has steps, large gopuram gateways",Local guides available,"Available nearby, charges nominal","Hotels, lodges, restaurants",Famous for Arunachala hill; Girivalam (circumambulation) ritual draws lakhs of devotees.
Srirangam Ranganathaswamy Temple,Tiruchirappalli (Tamil Nadu),Temple (Vaishnavite; largest functioning Hindu temple complex),https://srirangam.org,"https://en.wikipedia.org/wiki/Ranganathaswamy_Temple,_Srirangam",Srirangam Railway Station; Tiruchirappalli Junction,Srirangam Bus Stand,No metro available,Tiruchirappalli International Airport,6 am – 9 pm (with breaks),Free; ₹50–₹250 for special darshan,December–January (Vaikunta Ekadasi festival),"Well connected; large temple complex, partially wheelchair accessible",Available in English/Tamil,Nearby lots; charges apply,"Restaurants, pilgrim lodges",Rich temple architecture; important for Vaishnavites.
Kolli Hills,Namakkal District (Tamil Nadu),Hill Station / Trekking / Waterfalls,Not documented,https://en.wikipedia.org/wiki/Kolli_Hills,Namakkal,Semmedu Bus Stand (in Kolli Hills),No metro available,Tiruchirappalli,Open year-round,Free; attractions may charge small fees,November–April,70 hairpin bends on ghat road; steep trekking at waterfalls,Local guides for trekking,Available near viewpoints,"Resorts, homestays, food stalls","Famous for Agaya Gangai waterfall, Siddhar caves, and hairpin bends."
Pichavaram Mangrove Forest,Cuddalore District (Tamil Nadu),Eco-tourism / Boating,https://www.tamilnadutourism.tn.gov.in/destinations/pichavaram,https://en.wikipedia.org/wiki/Pichavaram,Chidambaram,Chidambaram Bus Stand,No metro available,Chennai or Trichy,8 am – 5 pm,Boating charges: ₹200–₹1000 depending on boat & duration,November–February,"Good roads; boats are rowboats/motorboats, not wheelchair-friendly",Local boatmen act as guides,Available at boating point,"Restaurants, restrooms, shops",Second largest mangrove in the world; popular for boating inside narrow creeks.
Thanjavur Maratha Palace & Art Gallery,Thanjavur (Tamil Nadu),Historical Palace / Museum,Not documented,https://en.wikipedia.org/wiki/Thanjavur_Maratha_palace,Thanjavur Junction,Thanjavur Central,No metro available,Trichy Airport,9 am – 6 pm (varies),₹10–₹50 (museum charges vary),October–March,Steps & courtyards; partial wheelchair access,Local guides available,Available nearby,"Restaurants, hotels",Houses Saraswathi Mahal Library and art gallery with Chola bronzes.
Kanchipuram Temples,Kanchipuram (Tamil Nadu),Temples (Vaishnavite & Shaivite; one of Sapta Puri pilgrimage cities),Not documented,https://en.wikipedia.org/wiki/Kanchipuram,Kanchipuram Railway Station,Kanchipuram Bus Stand,No metro available,Chennai Airport,"Varies temple to temple (generally 6 am – 12 pm, 4 pm – 8 pm)",Free; special darshan fees at some temples,Oct–Mar,"Well-connected city; temples with steps, mixed accessibility",Local temple guides available,Town parking spaces available,"Silk shops, lodges, restaurants","“City of Thousand Temples”; famous for silk sarees and heritage temples like Ekambareswarar, Kailasanathar."
Guindy National Park & Snake Park,Chennai (Tamil Nadu),National Park / Zoo / Snake Park,https://www.chennaimetrorail.org/guindy-national-park,https://en.wikipedia.org/wiki/Guindy_National_Park,Saidapet / Guindy,Guindy Bus Stand,Guindy Metro Station,Chennai Airport,9 am – 6 pm (closed Tuesdays),"₹20 adults, ₹5 children, camera charges extra",Nov–Feb,"City location, good roads, walkways","Interpretation centre, naturalists sometimes available",Paid parking near entry,"Cafes, restrooms, museum","Only national park inside a metro city; houses blackbuck, spotted deer, snakes, birds."
